{
  "$schema": "https://json-schema.org/draft/2020-12/schema",
  "$id": "https://game-mvp.local/schemas/scene.schema.json",
  "title": "Сцена (SER-7)",
  "type": "object",
  "additionalProperties": false,
  "required": [
    "components"
  ],
  "properties": {
    "components": {
      "$comment": "Порядок задаёт битовые id компонентов и является частью формата (SER-7).",
      "type": "array",
      "items": {
        "$ref": "#/$defs/component"
      }
    },
    "prefabs": {
      "type": "array",
      "items": {
        "$ref": "#/$defs/prefab"
      }
    },
    "systems": {
      "type": "array",
      "items": {
        "$ref": "#/$defs/system"
      }
    },
    "capacity": {
      "type": "integer",
      "minimum": 1
    },
    "terrain": {
      "$comment": "Компонент карты пола и его prefab порождаются из ассета загрузчиком (TERR-6).",
      "$ref": "#/$defs/terrain"
    },
    "arena": {
      "$comment": "Компоненты радиуса и состояния границы и prefab порождаются из ассета загрузчиком (ARENA-1).",
      "$ref": "#/$defs/arena"
    },
    "timeScale": {
      "$comment": "Подключает TimeScale, TimeScaleModifiers и сведение источников (TIME-2, TIME-7).",
      "type": "boolean"
    },
    "tweens": {
      "$comment": "Таблица определений твинов (TWEEN-1, TWEEN-3): наличие включает TweenSystem.",
      "type": "array",
      "items": {
        "$ref": "#/$defs/tweenDef"
      }
    },
    "fog": {
      "$comment": "Подключает компоненты тумана войны (FOW-1..3).",
      "type": "boolean"
    },
    "modifierSlots": {
      "$comment": "Число слотов в списках источников-модификаторов; по умолчанию 4 (TIME-7, SER-7).",
      "type": "integer",
      "minimum": 1
    },
    "initial": {
      "type": "array",
      "items": {
        "$ref": "#/$defs/spawnEntry"
      },
      "$comment": "Расстановка сцены: после сущностей-носителей и до расстановки прогона (SER-7, SER-8)."
    }
  },
  "$defs": {
    "action": {
      "$comment": "Узел действия: объект с одним ключом-именем (ACT-1). Состав аргументов проверяет загрузчик.",
      "type": "object",
      "minProperties": 1,
      "maxProperties": 1,
      "propertyNames": {
        "enum": [
          "addComponent",
          "addModifier",
          "addTween",
          "carveFloor",
          "destroyEntity",
          "emitEvent",
          "forEach",
          "forEachEvent",
          "if",
          "let",
          "modifyComponent",
          "random",
          "randomBelow",
          "removeComponent",
          "removeModifier",
          "set",
          "spawnEntity"
        ]
      }
    },
    "arena": {
      "title": "Ассет арены (ARENA-1)",
      "type": "object",
      "additionalProperties": false,
      "required": [
        "center",
        "radius"
      ],
      "properties": {
        "center": {
          "$comment": "Иммутабельный центр в Q16.16.",
          "$ref": "#/$defs/vec2"
        },
        "radius": {
          "$comment": "Стартовый радиус в Q16.16; дальше живёт в компоненте (ARENA-4).",
          "type": "integer"
        }
      }
    },
    "component": {
      "title": "Схема компонента (ECS-3)",
      "type": "object",
      "additionalProperties": false,
      "required": [
        "name",
        "fields"
      ],
      "properties": {
        "name": {
          "type": "string",
          "minLength": 1
        },
        "fields": {
          "type": "object",
          "minProperties": 1,
          "additionalProperties": {
            "enum": [
              "i32",
              "fixed",
              "entity"
            ]
          }
        },
        "defaults": {
          "$comment": "Значения в Q16.16 для полей типа fixed (FP-1); для поля entity — полный EntityId либо -1, «ссылки нет» (ECS-6).",
          "type": "object",
          "additionalProperties": {
            "type": "integer"
          }
        }
      }
    },
    "expression": {
      "$comment": "Узел выражения: объект с одним ключом-оператором (EXPR-1). Арность и типы проверяет загрузчик.",
      "oneOf": [
        {
          "type": "number"
        },
        {
          "type": "boolean"
        },
        {
          "type": "object",
          "minProperties": 1,
          "maxProperties": 1,
          "propertyNames": {
            "enum": [
              "!",
              "!=",
              "*",
              "+",
              "-",
              "/",
              "<",
              "<=",
              "==",
              ">",
              ">=",
              "abs",
              "and",
              "bitTest",
              "clamp",
              "cos",
              "eventField",
              "fromInt",
              "getComponent",
              "hasComponent",
              "hasFloorAt",
              "if",
              "isAlive",
              "max",
              "min",
              "or",
              "raycastEntity",
              "raycastHit",
              "raycastPoint",
              "sin",
              "sqrt",
              "tick",
              "toInt",
              "var",
              "vec",
              "vec.add",
              "vec.dot",
              "vec.length",
              "vec.lengthSq",
              "vec.normalize",
              "vec.scale",
              "vec.sub",
              "vec.x",
              "vec.y"
            ]
          }
        }
      ]
    },
    "prefab": {
      "title": "Prefab (ECS-4)",
      "type": "object",
      "additionalProperties": false,
      "required": [
        "name",
        "components"
      ],
      "properties": {
        "name": {
          "type": "string",
          "minLength": 1
        },
        "components": {
          "type": "object",
          "additionalProperties": {
            "type": "object",
            "additionalProperties": {
              "type": "integer"
            }
          }
        },
        "tags": {
          "type": "array",
          "items": {
            "type": "string",
            "minLength": 1
          }
        }
      }
    },
    "query": {
      "type": "object",
      "additionalProperties": false,
      "properties": {
        "all": {
          "type": "array",
          "items": {
            "type": "string",
            "minLength": 1
          }
        },
        "any": {
          "type": "array",
          "items": {
            "type": "string",
            "minLength": 1
          }
        },
        "not": {
          "type": "array",
          "items": {
            "type": "string",
            "minLength": 1
          }
        },
        "withTag": {
          "type": "string",
          "minLength": 1
        },
        "withinRadius": {
          "type": "object",
          "additionalProperties": false,
          "required": [
            "center",
            "radius"
          ],
          "properties": {
            "center": {
              "$ref": "#/$defs/expression"
            },
            "radius": {
              "$ref": "#/$defs/expression"
            }
          }
        }
      }
    },
    "spawnEntry": {
      "title": "Запись начальной расстановки (SER-8)",
      "type": "object",
      "additionalProperties": false,
      "required": [
        "prefab"
      ],
      "properties": {
        "prefab": {
          "type": "string",
          "minLength": 1
        },
        "overrides": {
          "$comment": "Карта «компонент → поле → значение» поверх значений prefab'а (CMD-6).",
          "type": "object",
          "additionalProperties": {
            "type": "object",
            "additionalProperties": {
              "type": "integer"
            }
          }
        }
      }
    },
    "system": {
      "title": "JSON-описание системы (SYS-1)",
      "type": "object",
      "additionalProperties": false,
      "required": [
        "name",
        "order",
        "do"
      ],
      "properties": {
        "name": {
          "$comment": "Имя RNG-стрима и ключ подмены (RNG-4, SYS-7).",
          "type": "string",
          "minLength": 1
        },
        "order": {
          "$comment": "Место системы в тике; равные order недопустимы (SYS-2, DET-9).",
          "type": "integer"
        },
        "query": {
          "$comment": "Сахар над действием forEach (SYS-1).",
          "$ref": "#/$defs/query"
        },
        "as": {
          "type": "string",
          "minLength": 1
        },
        "do": {
          "type": "array",
          "items": {
            "$ref": "#/$defs/action"
          }
        }
      }
    },
    "terrain": {
      "title": "Ассет террейна (TERR-2, TERR-3)",
      "type": "object",
      "additionalProperties": false,
      "required": [
        "width",
        "height",
        "tileSize",
        "levels",
        "flags"
      ],
      "properties": {
        "width": {
          "type": "integer",
          "minimum": 1
        },
        "height": {
          "type": "integer",
          "minimum": 1
        },
        "tileSize": {
          "$comment": "Размер клетки в Q16.16 (FP-1, TERR-2).",
          "type": "integer",
          "minimum": 1
        },
        "levels": {
          "$comment": "Строка на ряд, шестнадцатеричная цифра в верхнем регистре на клетку (TERR-3).",
          "type": "array",
          "items": {
            "type": "string",
            "pattern": "^[0-9A-F]+$"
          },
          "minItems": 1
        },
        "flags": {
          "$comment": "`.` обычная, `^` рампа, `_` нет пола — вне алфавита карты уровней (TERR-3).",
          "type": "array",
          "items": {
            "type": "string",
            "pattern": "^[.^_]+$"
          },
          "minItems": 1
        }
      }
    },
    "tweenDef": {
      "title": "Определение твина (TWEEN-1, TWEEN-3)",
      "type": "object",
      "additionalProperties": false,
      "required": [
        "target"
      ],
      "properties": {
        "target": {
          "$comment": "Путь к полю компонента, например \"Health.value\" (TWEEN-3).",
          "type": "string",
          "minLength": 1
        },
        "onComplete": {
          "$comment": "Исполняется по завершении твина (TWEEN-4).",
          "type": "array",
          "items": {
            "$ref": "#/$defs/action"
          }
        }
      }
    },
    "vec2": {
      "$comment": "Компоненты в Q16.16 (FP-1).",
      "type": "object",
      "additionalProperties": false,
      "required": [
        "x",
        "y"
      ],
      "properties": {
        "x": {
          "type": "integer"
        },
        "y": {
          "type": "integer"
        }
      }
    }
  }
}
